{
  "$schema": "http://json-schema.org/draft-04/schema#",
  "title": "Create a Self-Employment Period Summary",
  "description": "Create a Self-Employment Period Summary Request",
  "type": "object",
  "properties": {
    "periodDates": {
      "$ref": "periodic/period_dates.json"
    },
    "periodIncome": {
      "$ref": "periodic/period_income.json"
    },
    "periodAllowableExpenses": {
      "$ref": "periodic/period_allowable_expenses.json"
    },
    "periodDisallowableExpenses": {
      "$ref": "periodic/period_disallowable_expenses.json"
    }
  },
  "additionalProperties": false,
  "required": [
    "periodDates"
  ]
}